2024-09-17 14:32:50 INFO     Trial 149 finished with value: 0.8859738722595247 and parameters: {'clf__max_delta_step': 66.07366769490972, 'clf__max_depth': 11, 'clf__reg_lambda': 3.3726809512210894, 'clf__gamma': 31.5183192122046, 'clf__min_child_weight': 2.813940735367958, 'clf__reg_alpha': 0.03604444758729686, 'clf__learning_rate': 0.019233907918683034, 'clf__grow_policy': 'lossguide'}. Best is trial 119 with value: 0.9338393102874843.
2024-09-17 14:39:47 INFO     Trial 150 finished with value: 0.9200227539142442 and parameters: {'clf__max_delta_step': 47.46377020356493, 'clf__max_depth': 10, 'clf__reg_lambda': 2.7641425141390146, 'clf__gamma': 20.888103143858817, 'clf__min_child_weight': 7.569946046720959, 'clf__reg_alpha': 1.747178593932678, 'clf__learning_rate': 0.02667788651304415, 'clf__grow_policy': 'lossguide'}. Best is trial 119 with value: 0.9338393102874843.
2024-09-17 14:44:24 INFO     Trial 151 finished with value: 0.7791520363871229 and parameters: {'clf__max_delta_step': 54.43320130415514, 'clf__max_depth': 9, 'clf__reg_lambda': 1.3380673804064755, 'clf__gamma': 20.052543310307627, 'clf__min_child_weight': 27.63682896591556, 'clf__reg_alpha': 2.4503694217904246, 'clf__learning_rate': 0.03947640427595632, 'clf__grow_policy': 'lossguide'}. Best is trial 119 with value: 0.9338393102874843.
2024-09-17 14:52:52 INFO     Trial 152 finished with value: 0.9121806615985936 and parameters: {'clf__max_delta_step': 34.30341232746051, 'clf__max_depth': 9, 'clf__reg_lambda': 2.232564535568115, 'clf__gamma': 22.93742997147562, 'clf__min_child_weight': 2.920459410960932, 'clf__reg_alpha': 3.573750011898514, 'clf__learning_rate': 0.022005277369636592, 'clf__grow_policy': 'lossguide'}. Best is trial 119 with value: 0.9338393102874843.
2024-09-17 15:00:08 INFO     Trial 153 finished with value: 0.889470149690761 and parameters: {'clf__max_delta_step': 37.540364251068155, 'clf__max_depth': 10, 'clf__reg_lambda': 0.9753425211891045, 'clf__gamma': 37.83468832062078, 'clf__min_child_weight': 1.0701952141841689, 'clf__reg_alpha': 1.2278816195749713, 'clf__learning_rate': 0.03104183053898317, 'clf__grow_policy': 'lossguide'}. Best is trial 119 with value: 0.9338393102874843.
2024-09-17 15:08:40 INFO     Trial 154 finished with value: 0.8042810787238031 and parameters: {'clf__max_delta_step': 44.4625541753613, 'clf__max_depth': 10, 'clf__reg_lambda': 4.001422355846088, 'clf__gamma': 18.96638658501419, 'clf__min_child_weight': 4.853004106488004, 'clf__reg_alpha': 2.0338459973513463, 'clf__learning_rate': 0.015295141511562332, 'clf__grow_policy': 'lossguide'}. Best is trial 119 with value: 0.9338393102874843.
2024-09-17 15:15:27 INFO     Trial 155 finished with value: 0.9292725914350211 and parameters: {'clf__max_delta_step': 60.52763961329952, 'clf__max_depth': 11, 'clf__reg_lambda': 3.057422422365229, 'clf__gamma': 20.088835725400138, 'clf__min_child_weight': 3.681536923477931, 'clf__reg_alpha': 2.4748538814240533, 'clf__learning_rate': 0.04429828422867848, 'clf__grow_policy': 'lossguide'}. Best is trial 119 with value: 0.9338393102874843.
2024-09-17 15:24:52 INFO     Trial 156 finished with value: 0.4130265143945898 and parameters: {'clf__max_delta_step': 59.725351514349285, 'clf__max_depth': 11, 'clf__reg_lambda': 2.8978491584051165, 'clf__gamma': 21.739185842367, 'clf__min_child_weight': 3.9501406331390845, 'clf__reg_alpha': 2.648062889545649, 'clf__learning_rate': 0.010944761190911463, 'clf__grow_policy': 'lossguide'}. Best is trial 119 with value: 0.9338393102874843.
2024-09-17 15:30:02 INFO     Trial 157 finished with value: 0.778687109248506 and parameters: {'clf__max_delta_step': 55.14860960883331, 'clf__max_depth': 11, 'clf__reg_lambda': 21.94070185476681, 'clf__gamma': 19.698514062503794, 'clf__min_child_weight': 5.6178534420289274, 'clf__reg_alpha': 0.6753029318171435, 'clf__learning_rate': 0.057581361192447306, 'clf__grow_policy': 'lossguide'}. Best is trial 119 with value: 0.9338393102874843.
2024-09-17 15:36:41 INFO     Trial 158 finished with value: 0.933334143518314 and parameters: {'clf__max_delta_step': 40.15661988082412, 'clf__max_depth': 11, 'clf__reg_lambda': 1.6372018569476405, 'clf__gamma': 24.34384864877535, 'clf__min_child_weight': 2.293743966373421, 'clf__reg_alpha': 1.8630946729185864, 'clf__learning_rate': 0.046779024665891566, 'clf__grow_policy': 'lossguide'}. Best is trial 119 with value: 0.9338393102874843.
2024-09-17 15:44:28 INFO     Trial 159 finished with value: 0.9358661138082169 and parameters: {'clf__max_delta_step': 40.23331277707074, 'clf__max_depth': 11, 'clf__reg_lambda': 0.019710998210811237, 'clf__gamma': 25.047678170913976, 'clf__min_child_weight': 2.2956319404678, 'clf__reg_alpha': 1.834436046249881, 'clf__learning_rate': 0.0372265279270068, 'clf__grow_policy': 'lossguide'}. Best is trial 159 with value: 0.9358661138082169.
2024-09-17 18:11:41 INFO     HTTP Request: POST https://api.openai.com/v1/embeddings "HTTP/1.1 200 OK"
2024-09-17 18:12:20 INFO     HTTP Request: POST https://api.openai.com/v1/embeddings "HTTP/1.1 200 OK"
2024-09-17 18:12:58 INFO     HTTP Request: POST https://api.openai.com/v1/embeddings "HTTP/1.1 200 OK"
2024-09-17 18:13:39 INFO     HTTP Request: POST https://api.openai.com/v1/embeddings "HTTP/1.1 200 OK"
2024-09-17 18:14:17 INFO     HTTP Request: POST https://api.openai.com/v1/embeddings "HTTP/1.1 200 OK"
2024-09-17 18:14:59 INFO     HTTP Request: POST https://api.openai.com/v1/embeddings "HTTP/1.1 200 OK"
2024-09-17 18:15:41 INFO     HTTP Request: POST https://api.openai.com/v1/embeddings "HTTP/1.1 200 OK"
2024-09-17 18:16:18 INFO     HTTP Request: POST https://api.openai.com/v1/embeddings "HTTP/1.1 200 OK"
2024-09-17 18:16:57 INFO     HTTP Request: POST https://api.openai.com/v1/embeddings "HTTP/1.1 200 OK"
2024-09-17 18:17:37 INFO     HTTP Request: POST https://api.openai.com/v1/embeddings "HTTP/1.1 200 OK"
2024-09-17 18:18:16 INFO     HTTP Request: POST https://api.openai.com/v1/embeddings "HTTP/1.1 200 OK"
2024-09-17 18:19:02 INFO     HTTP Request: POST https://api.openai.com/v1/embeddings "HTTP/1.1 200 OK"
2024-09-17 18:20:27 INFO     HTTP Request: POST https://api.openai.com/v1/embeddings "HTTP/1.1 200 OK"
2024-09-17 18:21:09 INFO     HTTP Request: POST https://api.openai.com/v1/embeddings "HTTP/1.1 200 OK"
2024-09-18 17:30:58 INFO     HTTP Request: POST https://api.openai.com/v1/embeddings "HTTP/1.1 200 OK"
2024-09-18 17:31:42 INFO     HTTP Request: POST https://api.openai.com/v1/embeddings "HTTP/1.1 200 OK"
2024-09-18 17:32:28 INFO     HTTP Request: POST https://api.openai.com/v1/embeddings "HTTP/1.1 200 OK"
2024-09-18 17:33:10 INFO     HTTP Request: POST https://api.openai.com/v1/embeddings "HTTP/1.1 200 OK"
2024-09-18 17:33:50 INFO     HTTP Request: POST https://api.openai.com/v1/embeddings "HTTP/1.1 200 OK"
2024-09-18 17:34:30 INFO     HTTP Request: POST https://api.openai.com/v1/embeddings "HTTP/1.1 200 OK"
2024-09-18 17:35:14 INFO     HTTP Request: POST https://api.openai.com/v1/embeddings "HTTP/1.1 200 OK"
2024-09-18 17:35:57 INFO     HTTP Request: POST https://api.openai.com/v1/embeddings "HTTP/1.1 200 OK"
2024-09-18 17:36:40 INFO     HTTP Request: POST https://api.openai.com/v1/embeddings "HTTP/1.1 200 OK"
2024-09-18 17:37:24 INFO     HTTP Request: POST https://api.openai.com/v1/embeddings "HTTP/1.1 200 OK"
2024-09-18 17:38:11 INFO     HTTP Request: POST https://api.openai.com/v1/embeddings "HTTP/1.1 200 OK"
2024-09-18 17:38:53 INFO     HTTP Request: POST https://api.openai.com/v1/embeddings "HTTP/1.1 200 OK"
2024-09-18 17:39:32 INFO     HTTP Request: POST https://api.openai.com/v1/embeddings "HTTP/1.1 200 OK"
2024-09-18 17:40:09 INFO     HTTP Request: POST https://api.openai.com/v1/embeddings "HTTP/1.1 200 OK"
