2024-09-16 23:40:44 INFO     A new study created in RDB with name: xgboost-study1
2024-09-16 23:40:44 INFO     START OPTUNA OPTIMIZATION...
2024-09-16 23:45:34 INFO     Trial 0 finished with value: 0.6411970592103502 and parameters: {'clf__max_delta_step': 14.592736422565732, 'clf__max_depth': 2, 'clf__reg_lambda': 16.71077091961689, 'clf__gamma': 34.22459784342153, 'clf__min_child_weight': 38.99101951036662, 'clf__reg_alpha': 5.12699130717992, 'clf__learning_rate': 0.5926803180751559, 'clf__grow_policy': 'depthwise'}. Best is trial 0 with value: 0.6411970592103502.
2024-09-16 23:48:40 INFO     Trial 1 finished with value: 0.2270121755724705 and parameters: {'clf__max_delta_step': 76.26184788242598, 'clf__max_depth': 10, 'clf__reg_lambda': 16.626244855571507, 'clf__gamma': 42.33521154429099, 'clf__min_child_weight': 6.921424568261193, 'clf__reg_alpha': 16.329763118953704, 'clf__learning_rate': 9.948806775342431, 'clf__grow_policy': 'lossguide'}. Best is trial 0 with value: 0.6411970592103502.
2024-09-16 23:51:30 INFO     Trial 2 finished with value: 0.4949288727789036 and parameters: {'clf__max_delta_step': 17.510360352427025, 'clf__max_depth': 2, 'clf__reg_lambda': 2.0522289214559386, 'clf__gamma': 34.3206096589884, 'clf__min_child_weight': 23.110407074123966, 'clf__reg_alpha': 4.773302912978641, 'clf__learning_rate': 8.269732370890994, 'clf__grow_policy': 'lossguide'}. Best is trial 0 with value: 0.6411970592103502.
2024-09-16 23:54:30 INFO     Trial 3 finished with value: 0.5617217609271223 and parameters: {'clf__max_delta_step': 93.20970642029044, 'clf__max_depth': 2, 'clf__reg_lambda': 20.157874906410246, 'clf__gamma': 19.97540798433599, 'clf__min_child_weight': 36.05320467163717, 'clf__reg_alpha': 29.664202640045904, 'clf__learning_rate': 0.18184278131329798, 'clf__grow_policy': 'lossguide'}. Best is trial 0 with value: 0.6411970592103502.
2024-09-16 23:59:12 INFO     Trial 4 finished with value: 0.7224608203322737 and parameters: {'clf__max_delta_step': 58.51193103525297, 'clf__max_depth': 9, 'clf__reg_lambda': 13.046771342297305, 'clf__gamma': 27.698100572601803, 'clf__min_child_weight': 20.442690521707846, 'clf__reg_alpha': 6.579909801871027, 'clf__learning_rate': 0.028465150048488767, 'clf__grow_policy': 'depthwise'}. Best is trial 4 with value: 0.7224608203322737.
2024-09-17 00:02:09 INFO     Trial 5 finished with value: 0.8268116568968654 and parameters: {'clf__max_delta_step': 39.2644548703354, 'clf__max_depth': 5, 'clf__reg_lambda': 20.89126843479174, 'clf__gamma': 10.397363106512664, 'clf__min_child_weight': 24.080176109273285, 'clf__reg_alpha': 3.8285164293621614, 'clf__learning_rate': 1.111883010724621, 'clf__grow_policy': 'lossguide'}. Best is trial 5 with value: 0.8268116568968654.
2024-09-17 00:05:49 INFO     Trial 6 finished with value: 0.7596108779075175 and parameters: {'clf__max_delta_step': 59.26158504514119, 'clf__max_depth': 9, 'clf__reg_lambda': 35.99005815341905, 'clf__gamma': 18.73390379416649, 'clf__min_child_weight': 8.009748947502386, 'clf__reg_alpha': 9.394706712958811, 'clf__learning_rate': 2.1367594276385833, 'clf__grow_policy': 'lossguide'}. Best is trial 5 with value: 0.8268116568968654.
2024-09-17 00:09:11 INFO     Trial 7 finished with value: 0.7090590742965502 and parameters: {'clf__max_delta_step': 57.98683149993521, 'clf__max_depth': 10, 'clf__reg_lambda': 8.691102668625835, 'clf__gamma': 3.202636159711061, 'clf__min_child_weight': 42.92410759574441, 'clf__reg_alpha': 12.007712274367485, 'clf__learning_rate': 0.4029346641441441, 'clf__grow_policy': 'lossguide'}. Best is trial 5 with value: 0.8268116568968654.
2024-09-17 00:12:04 INFO     Trial 8 finished with value: 0.5654490940916952 and parameters: {'clf__max_delta_step': 19.484296504714916, 'clf__max_depth': 8, 'clf__reg_lambda': 25.993029945545306, 'clf__gamma': 20.875614527113875, 'clf__min_child_weight': 48.08598325636357, 'clf__reg_alpha': 1.1338692293617958, 'clf__learning_rate': 0.7800420832333558, 'clf__grow_policy': 'depthwise'}. Best is trial 5 with value: 0.8268116568968654.
2024-09-17 00:15:35 INFO     Trial 9 finished with value: 0.4921838192943907 and parameters: {'clf__max_delta_step': 12.610916276619143, 'clf__max_depth': 4, 'clf__reg_lambda': 6.935672028443125, 'clf__gamma': 43.07988558093801, 'clf__min_child_weight': 36.114405133779115, 'clf__reg_alpha': 6.090601573159291, 'clf__learning_rate': 0.040373219762448606, 'clf__grow_policy': 'lossguide'}. Best is trial 5 with value: 0.8268116568968654.
2024-09-17 00:20:32 INFO     Trial 10 finished with value: 0.0 and parameters: {'clf__max_delta_step': 35.44521047520034, 'clf__max_depth': 5, 'clf__reg_lambda': 29.73941890659439, 'clf__gamma': 4.3777688827487165, 'clf__min_child_weight': 15.462640084664878, 'clf__reg_alpha': 18.799771721814405, 'clf__learning_rate': 0.000173949768825281, 'clf__grow_policy': 'depthwise'}. Best is trial 5 with value: 0.8268116568968654.
2024-09-17 00:29:08 INFO     Trial 11 finished with value: 0.0 and parameters: {'clf__max_delta_step': 42.610985061297754, 'clf__max_depth': 6, 'clf__reg_lambda': 36.448738407344386, 'clf__gamma': 11.453922860547708, 'clf__min_child_weight': 1.2340863807660751, 'clf__reg_alpha': 11.209516050517205, 'clf__learning_rate': 0.002679185028167204, 'clf__grow_policy': 'lossguide'}. Best is trial 5 with value: 0.8268116568968654.
2024-09-17 00:32:54 INFO     Trial 12 finished with value: 0.6727525196140067 and parameters: {'clf__max_delta_step': 73.0065034785109, 'clf__max_depth': 7, 'clf__reg_lambda': 37.719614081939795, 'clf__gamma': 13.05233214294082, 'clf__min_child_weight': 11.628967424365657, 'clf__reg_alpha': 0.4027257729288767, 'clf__learning_rate': 2.184072640615209, 'clf__grow_policy': 'lossguide'}. Best is trial 5 with value: 0.8268116568968654.
2024-09-17 00:36:57 INFO     Trial 13 finished with value: 0.6166756001705133 and parameters: {'clf__max_delta_step': 34.4490862136727, 'clf__max_depth': 11, 'clf__reg_lambda': 29.287024820956724, 'clf__gamma': 12.716842771327158, 'clf__min_child_weight': 29.842422956400803, 'clf__reg_alpha': 21.223849999313273, 'clf__learning_rate': 0.07947173176178852, 'clf__grow_policy': 'lossguide'}. Best is trial 5 with value: 0.8268116568968654.
2024-09-17 00:42:16 INFO     Trial 14 finished with value: 0.06719964615122365 and parameters: {'clf__max_delta_step': 51.64710271069907, 'clf__max_depth': 12, 'clf__reg_lambda': 23.772365480331203, 'clf__gamma': 17.855877973118197, 'clf__min_child_weight': 28.273412339330825, 'clf__reg_alpha': 12.17223022197415, 'clf__learning_rate': 0.009627086847517275, 'clf__grow_policy': 'lossguide'}. Best is trial 5 with value: 0.8268116568968654.
2024-09-17 00:47:42 INFO     Trial 15 finished with value: 0.8664150177888825 and parameters: {'clf__max_delta_step': 78.62269974917778, 'clf__max_depth': 7, 'clf__reg_lambda': 33.30108541244283, 'clf__gamma': 0.04177929510547784, 'clf__min_child_weight': 16.199464475686973, 'clf__reg_alpha': 9.05664313021317, 'clf__learning_rate': 1.4405571974030278, 'clf__grow_policy': 'lossguide'}. Best is trial 15 with value: 0.8664150177888825.
2024-09-17 00:51:21 INFO     Trial 16 finished with value: 0.7119129883839607 and parameters: {'clf__max_delta_step': 99.89089398829576, 'clf__max_depth': 4, 'clf__reg_lambda': 32.50646066984221, 'clf__gamma': 2.3273915923075066, 'clf__min_child_weight': 17.607113730481316, 'clf__reg_alpha': 22.36813810707382, 'clf__learning_rate': 2.2260853673047163, 'clf__grow_policy': 'lossguide'}. Best is trial 15 with value: 0.8664150177888825.
2024-09-17 00:56:21 INFO     Trial 17 finished with value: 0.0 and parameters: {'clf__max_delta_step': 77.85809452124148, 'clf__max_depth': 6, 'clf__reg_lambda': 22.8380904243449, 'clf__gamma': 8.019080719347262, 'clf__min_child_weight': 26.09295608593048, 'clf__reg_alpha': 8.283579821121515, 'clf__learning_rate': 0.0008885488980016845, 'clf__grow_policy': 'lossguide'}. Best is trial 15 with value: 0.8664150177888825.
2024-09-17 01:00:33 INFO     Trial 18 finished with value: 0.8693802238609705 and parameters: {'clf__max_delta_step': 87.26397219718967, 'clf__max_depth': 4, 'clf__reg_lambda': 31.333471444077354, 'clf__gamma': 0.9021400533683025, 'clf__min_child_weight': 31.503183082419284, 'clf__reg_alpha': 3.43027437224387, 'clf__learning_rate': 0.1609242254584009, 'clf__grow_policy': 'depthwise'}. Best is trial 18 with value: 0.8693802238609705.
2024-09-17 01:04:44 INFO     Trial 19 finished with value: 0.837335146010679 and parameters: {'clf__max_delta_step': 86.66912902774534, 'clf__max_depth': 4, 'clf__reg_lambda': 39.993989618432664, 'clf__gamma': 0.6527406730887767, 'clf__min_child_weight': 31.84397986589766, 'clf__reg_alpha': 13.91881894589438, 'clf__learning_rate': 0.17204577827041614, 'clf__grow_policy': 'depthwise'}. Best is trial 18 with value: 0.8693802238609705.
2024-09-17 01:09:20 INFO     Trial 20 finished with value: 0.13123533762632564 and parameters: {'clf__max_delta_step': 68.24590768840666, 'clf__max_depth': 7, 'clf__reg_lambda': 32.22936959975835, 'clf__gamma': 48.21938622797276, 'clf__min_child_weight': 14.841315623566487, 'clf__reg_alpha': 2.493075432612603, 'clf__learning_rate': 0.010954488206333601, 'clf__grow_policy': 'depthwise'}. Best is trial 18 with value: 0.8693802238609705.
2024-09-17 01:13:32 INFO     Trial 21 finished with value: 0.851058750092937 and parameters: {'clf__max_delta_step': 87.85942523768833, 'clf__max_depth': 4, 'clf__reg_lambda': 39.63985488876037, 'clf__gamma': 0.42607551150673945, 'clf__min_child_weight': 33.159446882522985, 'clf__reg_alpha': 14.469566819156578, 'clf__learning_rate': 0.16162411177798539, 'clf__grow_policy': 'depthwise'}. Best is trial 18 with value: 0.8693802238609705.
2024-09-17 01:16:57 INFO     Trial 22 finished with value: 0.6978468204836458 and parameters: {'clf__max_delta_step': 85.77949668304235, 'clf__max_depth': 3, 'clf__reg_lambda': 33.30150528988128, 'clf__gamma': 6.913645503064578, 'clf__min_child_weight': 33.192547527729936, 'clf__reg_alpha': 16.445477434445095, 'clf__learning_rate': 0.14136323362780268, 'clf__grow_policy': 'depthwise'}. Best is trial 18 with value: 0.8693802238609705.
2024-09-17 01:21:16 INFO     Trial 23 finished with value: 0.8244208298530873 and parameters: {'clf__max_delta_step': 88.32031488641354, 'clf__max_depth': 5, 'clf__reg_lambda': 27.839701521999892, 'clf__gamma': 0.4826314148568156, 'clf__min_child_weight': 43.04893645672219, 'clf__reg_alpha': 8.506555807491711, 'clf__learning_rate': 0.32081313763232827, 'clf__grow_policy': 'depthwise'}. Best is trial 18 with value: 0.8693802238609705.
2024-09-17 01:25:07 INFO     Trial 24 finished with value: 0.65917826903526 and parameters: {'clf__max_delta_step': 97.76000639581412, 'clf__max_depth': 3, 'clf__reg_lambda': 39.53910879249134, 'clf__gamma': 6.653376799576686, 'clf__min_child_weight': 21.459687587953496, 'clf__reg_alpha': 14.654415980935442, 'clf__learning_rate': 0.04185912355529299, 'clf__grow_policy': 'depthwise'}. Best is trial 18 with value: 0.8693802238609705.
2024-09-17 01:29:53 INFO     Trial 25 finished with value: 0.33893308453846677 and parameters: {'clf__max_delta_step': 67.32350622750432, 'clf__max_depth': 6, 'clf__reg_lambda': 33.86336980442025, 'clf__gamma': 15.02341154641444, 'clf__min_child_weight': 28.086538260139662, 'clf__reg_alpha': 25.322256116868104, 'clf__learning_rate': 0.018898910041033463, 'clf__grow_policy': 'depthwise'}. Best is trial 18 with value: 0.8693802238609705.
2024-09-17 01:32:46 INFO     Trial 26 finished with value: 0.24555126611102696 and parameters: {'clf__max_delta_step': 81.20829523570363, 'clf__max_depth': 3, 'clf__reg_lambda': 35.63048290666907, 'clf__gamma': 25.883719204884915, 'clf__min_child_weight': 41.89079935048039, 'clf__reg_alpha': 9.090519057575262, 'clf__learning_rate': 4.113388309026091, 'clf__grow_policy': 'depthwise'}. Best is trial 18 with value: 0.8693802238609705.
2024-09-17 01:37:41 INFO     Trial 27 finished with value: 0.6872808002777284 and parameters: {'clf__max_delta_step': 67.58648173778639, 'clf__max_depth': 8, 'clf__reg_lambda': 30.09589757822407, 'clf__gamma': 5.175198702150377, 'clf__min_child_weight': 34.27201097657994, 'clf__reg_alpha': 10.680076489289977, 'clf__learning_rate': 0.07749111667253442, 'clf__grow_policy': 'depthwise'}. Best is trial 18 with value: 0.8693802238609705.
2024-09-17 01:42:22 INFO     Trial 28 finished with value: 0.0 and parameters: {'clf__max_delta_step': 91.47903182053962, 'clf__max_depth': 5, 'clf__reg_lambda': 24.74209548255211, 'clf__gamma': 8.573548453500912, 'clf__min_child_weight': 49.89442907234414, 'clf__reg_alpha': 7.036307566948688, 'clf__learning_rate': 0.004358461403723879, 'clf__grow_policy': 'depthwise'}. Best is trial 18 with value: 0.8693802238609705.
2024-09-17 01:45:15 INFO     Trial 29 finished with value: 0.6343220652182815 and parameters: {'clf__max_delta_step': 83.8217411458034, 'clf__max_depth': 7, 'clf__reg_lambda': 15.94816750183416, 'clf__gamma': 31.85661538335754, 'clf__min_child_weight': 39.48278859455062, 'clf__reg_alpha': 3.0753720606851793, 'clf__learning_rate': 0.5948440165239163, 'clf__grow_policy': 'depthwise'}. Best is trial 18 with value: 0.8693802238609705.
2024-09-17 01:48:37 INFO     Trial 30 finished with value: 0.8660125060559485 and parameters: {'clf__max_delta_step': 74.08827704452932, 'clf__max_depth': 4, 'clf__reg_lambda': 26.562258973006116, 'clf__gamma': 0.5268452665561184, 'clf__min_child_weight': 18.42070415514152, 'clf__reg_alpha': 18.262494348700333, 'clf__learning_rate': 1.0416077449027488, 'clf__grow_policy': 'depthwise'}. Best is trial 18 with value: 0.8693802238609705.
2024-09-17 01:52:33 INFO     Trial 31 finished with value: 0.8643276070293922 and parameters: {'clf__max_delta_step': 72.79704400888615, 'clf__max_depth': 4, 'clf__reg_lambda': 31.497048313018638, 'clf__gamma': 0.19234223422053426, 'clf__min_child_weight': 20.363268580102886, 'clf__reg_alpha': 18.39407929267138, 'clf__learning_rate': 0.3085049518881346, 'clf__grow_policy': 'depthwise'}. Best is trial 18 with value: 0.8693802238609705.
2024-09-17 01:55:34 INFO     Trial 32 finished with value: 0.855122320611726 and parameters: {'clf__max_delta_step': 74.0263653874853, 'clf__max_depth': 3, 'clf__reg_lambda': 27.84060993664331, 'clf__gamma': 3.471676789772277, 'clf__min_child_weight': 17.74300466357467, 'clf__reg_alpha': 18.71049764896985, 'clf__learning_rate': 1.0375153616586958, 'clf__grow_policy': 'depthwise'}. Best is trial 18 with value: 0.8693802238609705.
2024-09-17 01:58:30 INFO     Trial 33 finished with value: 0.15723800181341552 and parameters: {'clf__max_delta_step': 78.19443382183893, 'clf__max_depth': 2, 'clf__reg_lambda': 26.692488665934533, 'clf__gamma': 4.948527099577301, 'clf__min_child_weight': 11.426472231155092, 'clf__reg_alpha': 17.858569687475597, 'clf__learning_rate': 4.963755158865028, 'clf__grow_policy': 'depthwise'}. Best is trial 18 with value: 0.8693802238609705.
2024-09-17 02:02:07 INFO     Trial 34 finished with value: 0.8323195936577903 and parameters: {'clf__max_delta_step': 64.69900030750345, 'clf__max_depth': 4, 'clf__reg_lambda': 31.460566085939316, 'clf__gamma': 0.35328057326522616, 'clf__min_child_weight': 20.02747125700044, 'clf__reg_alpha': 25.789860658280418, 'clf__learning_rate': 0.3394279067230553, 'clf__grow_policy': 'depthwise'}. Best is trial 18 with value: 0.8693802238609705.
2024-09-17 02:05:08 INFO     Trial 35 finished with value: 0.7519788053222606 and parameters: {'clf__max_delta_step': 73.99431513727663, 'clf__max_depth': 6, 'clf__reg_lambda': 34.355538649830194, 'clf__gamma': 8.07001972316305, 'clf__min_child_weight': 24.770543430402647, 'clf__reg_alpha': 20.601451427937405, 'clf__learning_rate': 1.3979728690497935, 'clf__grow_policy': 'depthwise'}. Best is trial 18 with value: 0.8693802238609705.
2024-09-17 02:08:03 INFO     Trial 36 finished with value: 0.1628235534988588 and parameters: {'clf__max_delta_step': 93.43610909878633, 'clf__max_depth': 2, 'clf__reg_lambda': 18.3434448707305, 'clf__gamma': 9.482784637051244, 'clf__min_child_weight': 12.246976404525522, 'clf__reg_alpha': 16.721187931474553, 'clf__learning_rate': 3.9057103949727203, 'clf__grow_policy': 'depthwise'}. Best is trial 18 with value: 0.8693802238609705.
2024-09-17 02:12:08 INFO     Trial 37 finished with value: 0.6780423955094594 and parameters: {'clf__max_delta_step': 51.06988388329913, 'clf__max_depth': 5, 'clf__reg_lambda': 22.548802887479624, 'clf__gamma': 15.638722649909175, 'clf__min_child_weight': 6.4170316188896095, 'clf__reg_alpha': 23.874086233456175, 'clf__learning_rate': 0.08681437058225172, 'clf__grow_policy': 'depthwise'}. Best is trial 18 with value: 0.8693802238609705.
2024-09-17 02:15:15 INFO     Trial 38 finished with value: 0.4912104329647623 and parameters: {'clf__max_delta_step': 0.7435604929242032, 'clf__max_depth': 3, 'clf__reg_lambda': 30.56824640349331, 'clf__gamma': 35.26030012493933, 'clf__min_child_weight': 23.154451959523982, 'clf__reg_alpha': 5.154672475704916, 'clf__learning_rate': 7.753307276197152, 'clf__grow_policy': 'lossguide'}. Best is trial 18 with value: 0.8693802238609705.
2024-09-17 02:18:34 INFO     Trial 39 finished with value: 0.6757610615274499 and parameters: {'clf__max_delta_step': 80.57899583653867, 'clf__max_depth': 8, 'clf__reg_lambda': 25.062669581307418, 'clf__gamma': 2.8327116700181447, 'clf__min_child_weight': 18.593384270433145, 'clf__reg_alpha': 29.972657472360233, 'clf__learning_rate': 0.45449427230395084, 'clf__grow_policy': 'depthwise'}. Best is trial 18 with value: 0.8693802238609705.
2024-09-17 02:21:55 INFO     Trial 40 finished with value: 0.8505367748385246 and parameters: {'clf__max_delta_step': 61.86152955361128, 'clf__max_depth': 9, 'clf__reg_lambda': 27.03780149590584, 'clf__gamma': 5.443267420650299, 'clf__min_child_weight': 8.62155970963304, 'clf__reg_alpha': 19.623188585481472, 'clf__learning_rate': 1.4752027024023087, 'clf__grow_policy': 'lossguide'}. Best is trial 18 with value: 0.8693802238609705.
2024-09-17 02:25:00 INFO     Trial 41 finished with value: 0.8568329860935973 and parameters: {'clf__max_delta_step': 73.08429238690199, 'clf__max_depth': 3, 'clf__reg_lambda': 28.324082123179128, 'clf__gamma': 2.3897631524720895, 'clf__min_child_weight': 16.748102453095555, 'clf__reg_alpha': 17.287215725336864, 'clf__learning_rate': 1.0265601803757698, 'clf__grow_policy': 'depthwise'}. Best is trial 18 with value: 0.8693802238609705.
2024-09-17 02:28:13 INFO     Trial 42 finished with value: 0.8782832720623058 and parameters: {'clf__max_delta_step': 69.70958076350466, 'clf__max_depth': 4, 'clf__reg_lambda': 29.426718972428322, 'clf__gamma': 2.753780337272809, 'clf__min_child_weight': 15.019483575342653, 'clf__reg_alpha': 17.169313003610487, 'clf__learning_rate': 0.7155945751694804, 'clf__grow_policy': 'depthwise'}. Best is trial 42 with value: 0.8782832720623058.
2024-09-17 02:31:47 INFO     Trial 43 finished with value: 0.8570545894945437 and parameters: {'clf__max_delta_step': 55.01798081538901, 'clf__max_depth': 4, 'clf__reg_lambda': 37.271561015958945, 'clf__gamma': 2.739597539436389, 'clf__min_child_weight': 22.040987126019154, 'clf__reg_alpha': 15.415546825004633, 'clf__learning_rate': 0.30228304095046954, 'clf__grow_policy': 'depthwise'}. Best is trial 42 with value: 0.8782832720623058.
2024-09-17 02:34:45 INFO     Trial 44 finished with value: 0.7263998938855325 and parameters: {'clf__max_delta_step': 68.94122360361636, 'clf__max_depth': 5, 'clf__reg_lambda': 20.62314023679623, 'clf__gamma': 23.365441873117568, 'clf__min_child_weight': 14.247089808563468, 'clf__reg_alpha': 21.85019154440857, 'clf__learning_rate': 0.6494292234248107, 'clf__grow_policy': 'depthwise'}. Best is trial 42 with value: 0.8782832720623058.
2024-09-17 02:37:56 INFO     Trial 45 finished with value: 0.2865355188134614 and parameters: {'clf__max_delta_step': 93.92530547246511, 'clf__max_depth': 2, 'clf__reg_lambda': 34.75160023722068, 'clf__gamma': 10.853152066981991, 'clf__min_child_weight': 4.830938009822663, 'clf__reg_alpha': 19.84540108653279, 'clf__learning_rate': 2.654658365106414, 'clf__grow_policy': 'depthwise'}. Best is trial 42 with value: 0.8782832720623058.
2024-09-17 02:41:21 INFO     Trial 46 finished with value: 0.8835151439254726 and parameters: {'clf__max_delta_step': 61.24929576825231, 'clf__max_depth': 4, 'clf__reg_lambda': 0.2417599243853772, 'clf__gamma': 5.9651169716191665, 'clf__min_child_weight': 19.632227602531575, 'clf__reg_alpha': 13.56238050561497, 'clf__learning_rate': 0.2454192751415286, 'clf__grow_policy': 'lossguide'}. Best is trial 46 with value: 0.8835151439254726.
2024-09-17 02:44:30 INFO     Trial 47 finished with value: 0.8612226266322668 and parameters: {'clf__max_delta_step': 61.88698866453229, 'clf__max_depth': 6, 'clf__reg_lambda': 2.2331294850425714, 'clf__gamma': 5.081177306002832, 'clf__min_child_weight': 14.05995041251918, 'clf__reg_alpha': 13.20367569221741, 'clf__learning_rate': 0.7857072195676567, 'clf__grow_policy': 'lossguide'}. Best is trial 46 with value: 0.8835151439254726.
2024-09-17 02:49:28 INFO     Trial 48 finished with value: 0.8983853650949245 and parameters: {'clf__max_delta_step': 46.980394860675545, 'clf__max_depth': 5, 'clf__reg_lambda': 12.701934379336937, 'clf__gamma': 6.635724260202974, 'clf__min_child_weight': 10.427367219085873, 'clf__reg_alpha': 10.40362498524518, 'clf__learning_rate': 0.05387301014397667, 'clf__grow_policy': 'lossguide'}. Best is trial 48 with value: 0.8983853650949245.
2024-09-17 02:54:18 INFO     Trial 49 finished with value: 0.8990266217716176 and parameters: {'clf__max_delta_step': 27.351712465832613, 'clf__max_depth': 5, 'clf__reg_lambda': 10.126887697975263, 'clf__gamma': 10.392308596878541, 'clf__min_child_weight': 10.124006100178594, 'clf__reg_alpha': 10.670077313965802, 'clf__learning_rate': 0.054280047709355884, 'clf__grow_policy': 'lossguide'}. Best is trial 49 with value: 0.8990266217716176.
