2024-09-21 09:50:19 INFO     Trial 460 finished with value: 0.9194502953035796 and parameters: {'clf__max_delta_step': 46.08904229507918, 'clf__max_depth': 12, 'clf__reg_lambda': 1.4319181926765587, 'clf__gamma': 34.065241401827926, 'clf__min_child_weight': 3.055608427498182, 'clf__reg_alpha': 2.5632230717527182, 'clf__learning_rate': 0.09064205424156924, 'clf__grow_policy': 'lossguide'}. Best is trial 159 with value: 0.9358661138082169.
2024-09-21 09:54:50 INFO     Trial 461 finished with value: 0.918656052964823 and parameters: {'clf__max_delta_step': 39.88441011048143, 'clf__max_depth': 12, 'clf__reg_lambda': 0.4814382377813031, 'clf__gamma': 32.40857465110762, 'clf__min_child_weight': 4.017072487385586, 'clf__reg_alpha': 4.2173722146307275, 'clf__learning_rate': 0.07943434572197525, 'clf__grow_policy': 'lossguide'}. Best is trial 159 with value: 0.9358661138082169.
