2024-09-17 09:04:24 INFO     Trial 100 finished with value: 0.9249326638417668 and parameters: {'clf__max_delta_step': 11.288923580963298, 'clf__max_depth': 11, 'clf__reg_lambda': 0.09902869724396668, 'clf__gamma': 16.51362471935643, 'clf__min_child_weight': 3.1618458578101385, 'clf__reg_alpha': 6.762263734702041, 'clf__learning_rate': 0.07019089912621851, 'clf__grow_policy': 'lossguide'}. Best is trial 73 with value: 0.9282550154321259.
2024-09-17 09:10:18 INFO     Trial 101 finished with value: 0.926654942909965 and parameters: {'clf__max_delta_step': 11.136591892020693, 'clf__max_depth': 11, 'clf__reg_lambda': 0.6372472961094335, 'clf__gamma': 16.73996812709621, 'clf__min_child_weight': 2.061877812783923, 'clf__reg_alpha': 3.552987601473194, 'clf__learning_rate': 0.08608141262181113, 'clf__grow_policy': 'lossguide'}. Best is trial 73 with value: 0.9282550154321259.
2024-09-17 09:16:19 INFO     Trial 102 finished with value: 0.9249847694038337 and parameters: {'clf__max_delta_step': 48.159475111880326, 'clf__max_depth': 11, 'clf__reg_lambda': 2.2184879704612532, 'clf__gamma': 16.05039343083119, 'clf__min_child_weight': 1.789345699655092, 'clf__reg_alpha': 3.522278977312, 'clf__learning_rate': 0.08506185499211436, 'clf__grow_policy': 'lossguide'}. Best is trial 73 with value: 0.9282550154321259.
2024-09-17 09:22:33 INFO     Trial 103 finished with value: 0.9244263002962033 and parameters: {'clf__max_delta_step': 56.37536757484407, 'clf__max_depth': 11, 'clf__reg_lambda': 1.976717204717825, 'clf__gamma': 15.079286867321555, 'clf__min_child_weight': 3.340771774096869, 'clf__reg_alpha': 3.5528917624987173, 'clf__learning_rate': 0.06799064375659238, 'clf__grow_policy': 'lossguide'}. Best is trial 73 with value: 0.9282550154321259.
2024-09-17 09:28:24 INFO     Trial 104 finished with value: 0.9258995901713818 and parameters: {'clf__max_delta_step': 42.3362814005824, 'clf__max_depth': 12, 'clf__reg_lambda': 2.7432471982503954, 'clf__gamma': 16.168967841038963, 'clf__min_child_weight': 1.7994819002684057, 'clf__reg_alpha': 2.8122306408185525, 'clf__learning_rate': 0.08746286746171557, 'clf__grow_policy': 'lossguide'}. Best is trial 73 with value: 0.9282550154321259.
2024-09-17 09:33:53 INFO     Trial 105 finished with value: 0.9218883069736942 and parameters: {'clf__max_delta_step': 47.921520104840006, 'clf__max_depth': 12, 'clf__reg_lambda': 0.14523327007988585, 'clf__gamma': 11.50170510256268, 'clf__min_child_weight': 1.6276916746299714, 'clf__reg_alpha': 2.8944265632452546, 'clf__learning_rate': 0.17389881193857723, 'clf__grow_policy': 'lossguide'}. Best is trial 73 with value: 0.9282550154321259.
2024-09-17 09:39:45 INFO     Trial 106 finished with value: 0.9128070226057945 and parameters: {'clf__max_delta_step': 42.38999535996297, 'clf__max_depth': 12, 'clf__reg_lambda': 3.2159506112625293, 'clf__gamma': 10.006174962141591, 'clf__min_child_weight': 6.0406339747620095, 'clf__reg_alpha': 2.228819339412955, 'clf__learning_rate': 0.08662536124996288, 'clf__grow_policy': 'lossguide'}. Best is trial 73 with value: 0.9282550154321259.
2024-09-17 09:47:15 INFO     Trial 107 finished with value: 0.9264000173008876 and parameters: {'clf__max_delta_step': 51.82831139958979, 'clf__max_depth': 12, 'clf__reg_lambda': 2.2410507484404176, 'clf__gamma': 13.6015562220601, 'clf__min_child_weight': 1.9537620827998325, 'clf__reg_alpha': 1.1032900276868634, 'clf__learning_rate': 0.06262287245323636, 'clf__grow_policy': 'lossguide'}. Best is trial 73 with value: 0.9282550154321259.
2024-09-17 09:58:58 INFO     Trial 108 finished with value: 0.9213337478766803 and parameters: {'clf__max_delta_step': 54.11839253541611, 'clf__max_depth': 12, 'clf__reg_lambda': 2.591848075672468, 'clf__gamma': 12.24529351424067, 'clf__min_child_weight': 1.8880965146114674, 'clf__reg_alpha': 0.04644107794463492, 'clf__learning_rate': 0.023511671530984813, 'clf__grow_policy': 'lossguide'}. Best is trial 73 with value: 0.9282550154321259.
2024-09-17 10:03:14 INFO     Trial 109 finished with value: 0.9160913626966821 and parameters: {'clf__max_delta_step': 43.05198337636135, 'clf__max_depth': 12, 'clf__reg_lambda': 1.6560266095612644, 'clf__gamma': 13.30842095219625, 'clf__min_child_weight': 3.232130160281366, 'clf__reg_alpha': 1.1679374342982962, 'clf__learning_rate': 0.21624214808111078, 'clf__grow_policy': 'lossguide'}. Best is trial 73 with value: 0.9282550154321259.
2024-09-17 10:07:06 INFO     Trial 110 finished with value: 0.7374699380582151 and parameters: {'clf__max_delta_step': 2.202088563929798, 'clf__max_depth': 11, 'clf__reg_lambda': 4.8987671095614385, 'clf__gamma': 44.90542217610642, 'clf__min_child_weight': 1.1971873945040565, 'clf__reg_alpha': 3.924366142695913, 'clf__learning_rate': 0.13279556808222645, 'clf__grow_policy': 'lossguide'}. Best is trial 73 with value: 0.9282550154321259.
2024-09-17 10:13:23 INFO     Trial 111 finished with value: 0.9238124210949417 and parameters: {'clf__max_delta_step': 49.80434307240019, 'clf__max_depth': 11, 'clf__reg_lambda': 0.544903032982907, 'clf__gamma': 15.580877236114269, 'clf__min_child_weight': 3.1883227412755066, 'clf__reg_alpha': 6.755498906415251, 'clf__learning_rate': 0.0663052392997428, 'clf__grow_policy': 'lossguide'}. Best is trial 73 with value: 0.9282550154321259.
2024-09-17 10:18:27 INFO     Trial 112 finished with value: 0.9210535595413094 and parameters: {'clf__max_delta_step': 13.634515027682937, 'clf__max_depth': 12, 'clf__reg_lambda': 3.7535616053672305, 'clf__gamma': 14.895611202329965, 'clf__min_child_weight': 3.977799123800364, 'clf__reg_alpha': 1.9376473570104937, 'clf__learning_rate': 0.0951832115188915, 'clf__grow_policy': 'lossguide'}. Best is trial 73 with value: 0.9282550154321259.
2024-09-17 10:25:42 INFO     Trial 113 finished with value: 0.9303584819528871 and parameters: {'clf__max_delta_step': 52.73809079502135, 'clf__max_depth': 11, 'clf__reg_lambda': 1.686525769643432, 'clf__gamma': 18.85190724691152, 'clf__min_child_weight': 2.0232051579494, 'clf__reg_alpha': 2.467573236285055, 'clf__learning_rate': 0.04626304591568663, 'clf__grow_policy': 'lossguide'}. Best is trial 113 with value: 0.9303584819528871.
2024-09-17 10:29:33 INFO     Trial 114 finished with value: 0.6084606737850058 and parameters: {'clf__max_delta_step': 52.80914808921348, 'clf__max_depth': 11, 'clf__reg_lambda': 2.646604143859532, 'clf__gamma': 20.030344851865586, 'clf__min_child_weight': 45.6217669951076, 'clf__reg_alpha': 2.995846623176816, 'clf__learning_rate': 0.056887023070686764, 'clf__grow_policy': 'lossguide'}. Best is trial 113 with value: 0.9303584819528871.
2024-09-17 10:36:11 INFO     Trial 115 finished with value: 0.9312492563870023 and parameters: {'clf__max_delta_step': 58.068718917335815, 'clf__max_depth': 10, 'clf__reg_lambda': 1.6257670046765829, 'clf__gamma': 21.53224313940941, 'clf__min_child_weight': 2.2408191343206667, 'clf__reg_alpha': 1.035790084464102, 'clf__learning_rate': 0.04879939391881946, 'clf__grow_policy': 'lossguide'}. Best is trial 115 with value: 0.9312492563870023.
2024-09-17 10:41:47 INFO     Trial 116 finished with value: 0.9275870349165248 and parameters: {'clf__max_delta_step': 45.26903214604463, 'clf__max_depth': 10, 'clf__reg_lambda': 1.3943551361718964, 'clf__gamma': 21.481036426899866, 'clf__min_child_weight': 6.6349988712387535, 'clf__reg_alpha': 0.964889146007339, 'clf__learning_rate': 0.04642588545730914, 'clf__grow_policy': 'lossguide'}. Best is trial 115 with value: 0.9312492563870023.
2024-09-17 10:47:28 INFO     Trial 117 finished with value: 0.9280153466669234 and parameters: {'clf__max_delta_step': 45.25052567836234, 'clf__max_depth': 10, 'clf__reg_lambda': 4.066830683350407, 'clf__gamma': 21.439252055709286, 'clf__min_child_weight': 5.917025124527013, 'clf__reg_alpha': 1.025604023165372, 'clf__learning_rate': 0.045869317871966644, 'clf__grow_policy': 'lossguide'}. Best is trial 115 with value: 0.9312492563870023.
2024-09-17 10:52:59 INFO     Trial 118 finished with value: 0.9118551489286615 and parameters: {'clf__max_delta_step': 45.7974402581823, 'clf__max_depth': 10, 'clf__reg_lambda': 4.482973760793003, 'clf__gamma': 22.855595604991052, 'clf__min_child_weight': 6.613193374998883, 'clf__reg_alpha': 1.4681626051476788, 'clf__learning_rate': 0.043798322179691575, 'clf__grow_policy': 'lossguide'}. Best is trial 115 with value: 0.9312492563870023.
2024-09-17 10:58:15 INFO     Trial 119 finished with value: 0.9338393102874843 and parameters: {'clf__max_delta_step': 58.837125327775546, 'clf__max_depth': 10, 'clf__reg_lambda': 1.4488433679704436, 'clf__gamma': 27.75308658118742, 'clf__min_child_weight': 4.428780189956387, 'clf__reg_alpha': 0.9222098193111854, 'clf__learning_rate': 0.049862344797896835, 'clf__grow_policy': 'lossguide'}. Best is trial 119 with value: 0.9338393102874843.
2024-09-17 11:03:04 INFO     Trial 120 finished with value: 0.9323517984202987 and parameters: {'clf__max_delta_step': 57.40419035610148, 'clf__max_depth': 10, 'clf__reg_lambda': 1.4618028826555811, 'clf__gamma': 28.973240263598388, 'clf__min_child_weight': 5.5837136306106725, 'clf__reg_alpha': 0.8238041652413824, 'clf__learning_rate': 0.05419500970245581, 'clf__grow_policy': 'lossguide'}. Best is trial 119 with value: 0.9338393102874843.
2024-09-17 11:07:44 INFO     Trial 121 finished with value: 0.9045705656930054 and parameters: {'clf__max_delta_step': 57.90029254940696, 'clf__max_depth': 10, 'clf__reg_lambda': 1.4831521713450828, 'clf__gamma': 32.84356101899074, 'clf__min_child_weight': 5.679435131702039, 'clf__reg_alpha': 0.8047613836917864, 'clf__learning_rate': 0.0515922262391714, 'clf__grow_policy': 'lossguide'}. Best is trial 119 with value: 0.9338393102874843.
2024-09-17 11:12:28 INFO     Trial 122 finished with value: 0.8872048171896842 and parameters: {'clf__max_delta_step': 59.15096490490182, 'clf__max_depth': 10, 'clf__reg_lambda': 3.7874728984437707, 'clf__gamma': 27.343146432135153, 'clf__min_child_weight': 9.424356224863306, 'clf__reg_alpha': 0.680075881725817, 'clf__learning_rate': 0.04623518243445509, 'clf__grow_policy': 'lossguide'}. Best is trial 119 with value: 0.9338393102874843.
2024-09-17 11:19:41 INFO     Trial 123 finished with value: 0.5031556134345779 and parameters: {'clf__max_delta_step': 50.66454067441945, 'clf__max_depth': 10, 'clf__reg_lambda': 18.56559333350323, 'clf__gamma': 26.153510914475962, 'clf__min_child_weight': 4.309337555463325, 'clf__reg_alpha': 1.638724926536633, 'clf__learning_rate': 0.019019180466632497, 'clf__grow_policy': 'lossguide'}. Best is trial 119 with value: 0.9338393102874843.
2024-09-17 11:24:19 INFO     Trial 124 finished with value: 0.902940262063991 and parameters: {'clf__max_delta_step': 64.25937095528244, 'clf__max_depth': 10, 'clf__reg_lambda': 1.5005915428981207, 'clf__gamma': 29.04743076313298, 'clf__min_child_weight': 5.2736572005790805, 'clf__reg_alpha': 1.006841620481414, 'clf__learning_rate': 0.06072481698195375, 'clf__grow_policy': 'lossguide'}. Best is trial 119 with value: 0.9338393102874843.
2024-09-17 11:28:12 INFO     Trial 125 finished with value: 0.9247827943432281 and parameters: {'clf__max_delta_step': 55.96041760408502, 'clf__max_depth': 10, 'clf__reg_lambda': 0.03600054868909319, 'clf__gamma': 21.729862294528164, 'clf__min_child_weight': 7.726957645992104, 'clf__reg_alpha': 0.1413326284719345, 'clf__learning_rate': 0.12518205897665718, 'clf__grow_policy': 'lossguide'}. Best is trial 119 with value: 0.9338393102874843.
2024-09-17 11:32:30 INFO     Trial 126 finished with value: 0.9245318867288372 and parameters: {'clf__max_delta_step': 41.43027206825418, 'clf__max_depth': 10, 'clf__reg_lambda': 3.1417141616723008, 'clf__gamma': 21.382670185274222, 'clf__min_child_weight': 6.587695501662669, 'clf__reg_alpha': 2.1775101247434576, 'clf__learning_rate': 0.09053658551399726, 'clf__grow_policy': 'lossguide'}. Best is trial 119 with value: 0.9338393102874843.
2024-09-17 11:38:12 INFO     Trial 127 finished with value: 0.6251771136500164 and parameters: {'clf__max_delta_step': 45.18911045433414, 'clf__max_depth': 9, 'clf__reg_lambda': 1.0136362002688888, 'clf__gamma': 30.714843868688575, 'clf__min_child_weight': 4.164186437935557, 'clf__reg_alpha': 28.979930151444393, 'clf__learning_rate': 0.03142031621614739, 'clf__grow_policy': 'lossguide'}. Best is trial 119 with value: 0.9338393102874843.
2024-09-17 11:45:14 INFO     Trial 128 finished with value: 0.9026648529026553 and parameters: {'clf__max_delta_step': 53.248721172460584, 'clf__max_depth': 10, 'clf__reg_lambda': 4.569162375169446, 'clf__gamma': 23.79847116228072, 'clf__min_child_weight': 1.3737868569107798, 'clf__reg_alpha': 1.1561108565032376, 'clf__learning_rate': 0.044771821168905955, 'clf__grow_policy': 'lossguide'}. Best is trial 119 with value: 0.9338393102874843.
2024-09-17 11:49:40 INFO     Trial 129 finished with value: 0.9013008502759076 and parameters: {'clf__max_delta_step': 60.93879869250232, 'clf__max_depth': 10, 'clf__reg_lambda': 3.176375852934194, 'clf__gamma': 26.428042796638877, 'clf__min_child_weight': 9.01778748068513, 'clf__reg_alpha': 4.352211168300298, 'clf__learning_rate': 0.06665397103931953, 'clf__grow_policy': 'lossguide'}. Best is trial 119 with value: 0.9338393102874843.
2024-09-17 11:59:11 INFO     Trial 130 finished with value: 0.9134080335562984 and parameters: {'clf__max_delta_step': 49.50726907953088, 'clf__max_depth': 12, 'clf__reg_lambda': 1.2954852037516624, 'clf__gamma': 29.870188814302075, 'clf__min_child_weight': 1.0606308288676631, 'clf__reg_alpha': 1.698201524554996, 'clf__learning_rate': 0.022496538394309862, 'clf__grow_policy': 'lossguide'}. Best is trial 119 with value: 0.9338393102874843.
2024-09-17 12:07:58 INFO     Trial 131 finished with value: 0.924692966246432 and parameters: {'clf__max_delta_step': 56.40510683670698, 'clf__max_depth': 11, 'clf__reg_lambda': 2.7415145098305587, 'clf__gamma': 19.124973128575803, 'clf__min_child_weight': 2.6659578443829037, 'clf__reg_alpha': 2.389785405744173, 'clf__learning_rate': 0.02901252364109289, 'clf__grow_policy': 'lossguide'}. Best is trial 119 with value: 0.9338393102874843.
2024-09-17 12:14:42 INFO     Trial 132 finished with value: 0.9140431275283392 and parameters: {'clf__max_delta_step': 52.40079143842132, 'clf__max_depth': 11, 'clf__reg_lambda': 5.13608126293779, 'clf__gamma': 24.13213923453098, 'clf__min_child_weight': 3.5778994265279476, 'clf__reg_alpha': 0.02720147312196286, 'clf__learning_rate': 0.034235375059238286, 'clf__grow_policy': 'lossguide'}. Best is trial 119 with value: 0.9338393102874843.
2024-09-17 12:18:17 INFO     Trial 133 finished with value: 0.5598070103634498 and parameters: {'clf__max_delta_step': 62.61769798943608, 'clf__max_depth': 9, 'clf__reg_lambda': 1.9951308142067934, 'clf__gamma': 35.09832837941465, 'clf__min_child_weight': 37.351871970109165, 'clf__reg_alpha': 3.1551159405252904, 'clf__learning_rate': 0.052280755960196254, 'clf__grow_policy': 'lossguide'}. Best is trial 119 with value: 0.9338393102874843.
2024-09-17 12:29:15 INFO     Trial 134 finished with value: 0.9326022266996379 and parameters: {'clf__max_delta_step': 44.1566586096596, 'clf__max_depth': 11, 'clf__reg_lambda': 0.672155422338147, 'clf__gamma': 18.552621571241673, 'clf__min_child_weight': 2.246599730881426, 'clf__reg_alpha': 0.7620149101570295, 'clf__learning_rate': 0.01708452788372634, 'clf__grow_policy': 'lossguide'}. Best is trial 119 with value: 0.9338393102874843.
2024-09-17 12:37:44 INFO     Trial 135 finished with value: 0.9297007343773441 and parameters: {'clf__max_delta_step': 44.809061163819415, 'clf__max_depth': 10, 'clf__reg_lambda': 0.5606334977262628, 'clf__gamma': 20.346285596863144, 'clf__min_child_weight': 5.043000245346243, 'clf__reg_alpha': 0.7850748890050698, 'clf__learning_rate': 0.016361992203877383, 'clf__grow_policy': 'lossguide'}. Best is trial 119 with value: 0.9338393102874843.
2024-09-17 12:46:52 INFO     Trial 136 finished with value: 0.7641893274355402 and parameters: {'clf__max_delta_step': 45.47481404984827, 'clf__max_depth': 12, 'clf__reg_lambda': 1.2103033419274145, 'clf__gamma': 20.322684352926498, 'clf__min_child_weight': 5.787629858128081, 'clf__reg_alpha': 0.6944537522196499, 'clf__learning_rate': 0.011989417483701617, 'clf__grow_policy': 'lossguide'}. Best is trial 119 with value: 0.9338393102874843.
2024-09-17 12:56:32 INFO     Trial 137 finished with value: 0.11032879229462597 and parameters: {'clf__max_delta_step': 44.202490441746804, 'clf__max_depth': 9, 'clf__reg_lambda': 4.098869954915564, 'clf__gamma': 21.31141717413839, 'clf__min_child_weight': 2.0901364096329083, 'clf__reg_alpha': 1.369594019064705, 'clf__learning_rate': 0.008843810397368965, 'clf__grow_policy': 'lossguide'}. Best is trial 119 with value: 0.9338393102874843.
2024-09-17 13:04:53 INFO     Trial 138 finished with value: 0.9312085237022807 and parameters: {'clf__max_delta_step': 40.13586039710044, 'clf__max_depth': 10, 'clf__reg_lambda': 0.03361491233982594, 'clf__gamma': 24.97083970270098, 'clf__min_child_weight': 4.445364103328486, 'clf__reg_alpha': 1.9054674654515293, 'clf__learning_rate': 0.017586315227113482, 'clf__grow_policy': 'lossguide'}. Best is trial 119 with value: 0.9338393102874843.
2024-09-17 13:12:06 INFO     Trial 139 finished with value: 0.9229076889707912 and parameters: {'clf__max_delta_step': 39.37864425677855, 'clf__max_depth': 10, 'clf__reg_lambda': 0.7321681150778023, 'clf__gamma': 25.136086078453097, 'clf__min_child_weight': 7.10639707313425, 'clf__reg_alpha': 0.5835405452042339, 'clf__learning_rate': 0.017854684734838693, 'clf__grow_policy': 'lossguide'}. Best is trial 119 with value: 0.9338393102874843.
2024-09-17 13:20:03 INFO     Trial 140 finished with value: 0.0 and parameters: {'clf__max_delta_step': 31.53086680692118, 'clf__max_depth': 8, 'clf__reg_lambda': 0.00872329248276138, 'clf__gamma': 22.490436398406036, 'clf__min_child_weight': 4.80066081120952, 'clf__reg_alpha': 1.627005589071418, 'clf__learning_rate': 0.006341185973900177, 'clf__grow_policy': 'lossguide'}. Best is trial 119 with value: 0.9338393102874843.
2024-09-17 13:28:58 INFO     Trial 141 finished with value: 0.9267550889447711 and parameters: {'clf__max_delta_step': 36.03784017623554, 'clf__max_depth': 10, 'clf__reg_lambda': 1.697273068584501, 'clf__gamma': 19.68751084035164, 'clf__min_child_weight': 3.5398679935815087, 'clf__reg_alpha': 2.3114633024544666, 'clf__learning_rate': 0.021610951010812698, 'clf__grow_policy': 'lossguide'}. Best is trial 119 with value: 0.9338393102874843.
2024-09-17 13:38:32 INFO     Trial 142 finished with value: 0.4037010107650185 and parameters: {'clf__max_delta_step': 40.89604596743209, 'clf__max_depth': 10, 'clf__reg_lambda': 1.9726592328760626, 'clf__gamma': 18.9582373161529, 'clf__min_child_weight': 3.466576452379786, 'clf__reg_alpha': 2.034205456499132, 'clf__learning_rate': 0.010124548007499318, 'clf__grow_policy': 'lossguide'}. Best is trial 119 with value: 0.9338393102874843.
2024-09-17 13:46:47 INFO     Trial 143 finished with value: 0.9338013053252537 and parameters: {'clf__max_delta_step': 47.46713315931118, 'clf__max_depth': 10, 'clf__reg_lambda': 0.9035611535880377, 'clf__gamma': 26.83528165708468, 'clf__min_child_weight': 4.126508058458791, 'clf__reg_alpha': 1.1337454800502744, 'clf__learning_rate': 0.01609464711413743, 'clf__grow_policy': 'lossguide'}. Best is trial 119 with value: 0.9338393102874843.
2024-09-17 13:54:28 INFO     Trial 144 finished with value: 0.8595549456827215 and parameters: {'clf__max_delta_step': 48.78273170320766, 'clf__max_depth': 10, 'clf__reg_lambda': 0.8555244448321759, 'clf__gamma': 27.313054633033143, 'clf__min_child_weight': 5.716304675111827, 'clf__reg_alpha': 1.05903878344152, 'clf__learning_rate': 0.01445086890513463, 'clf__grow_policy': 'lossguide'}. Best is trial 119 with value: 0.9338393102874843.
2024-09-17 13:59:28 INFO     Trial 145 finished with value: 0.6291854382309281 and parameters: {'clf__max_delta_step': 46.64763096847864, 'clf__max_depth': 10, 'clf__reg_lambda': 1.7385620315245331, 'clf__gamma': 29.616677625327142, 'clf__min_child_weight': 25.813746279113413, 'clf__reg_alpha': 2.318929579788679, 'clf__learning_rate': 0.016920180025139425, 'clf__grow_policy': 'lossguide'}. Best is trial 119 with value: 0.9338393102874843.
2024-09-17 14:09:43 INFO     Trial 146 finished with value: 0.0 and parameters: {'clf__max_delta_step': 52.04505040480104, 'clf__max_depth': 10, 'clf__reg_lambda': 0.01715465383387966, 'clf__gamma': 24.120306625449906, 'clf__min_child_weight': 3.998914411647034, 'clf__reg_alpha': 0.29773603056823406, 'clf__learning_rate': 0.0003632598250245377, 'clf__grow_policy': 'lossguide'}. Best is trial 119 with value: 0.9338393102874843.
2024-09-17 14:17:15 INFO     Trial 147 finished with value: 0.9258603870120771 and parameters: {'clf__max_delta_step': 57.8084801954699, 'clf__max_depth': 11, 'clf__reg_lambda': 0.817015237150204, 'clf__gamma': 28.350505421244065, 'clf__min_child_weight': 4.6436362008939875, 'clf__reg_alpha': 1.251889646435233, 'clf__learning_rate': 0.022917142020616985, 'clf__grow_policy': 'lossguide'}. Best is trial 119 with value: 0.9338393102874843.
2024-09-17 14:24:48 INFO     Trial 148 finished with value: 0.6979672881341223 and parameters: {'clf__max_delta_step': 51.101412751228125, 'clf__max_depth': 10, 'clf__reg_lambda': 1.681536588993554, 'clf__gamma': 26.235680168034797, 'clf__min_child_weight': 6.597815128437938, 'clf__reg_alpha': 0.7554212868663855, 'clf__learning_rate': 0.012586205647539343, 'clf__grow_policy': 'lossguide'}. Best is trial 119 with value: 0.9338393102874843.
